"Code","Description","MedicalFrequency","AHDFrequency"
"7272600","Laser photocoagulation to lesion of retina NEC","1142","0"
"7272300","Laser destruction of lesion of retina","457","0"
"7272013","Laser therapy lesion of retina","5993","0"
"5B4..11","Retinal laser therapy","675","1417"
"7272012","Photocoagulation of lesion of retina NEC","1749","0"
"Z6F..11","Laser therapy","4472","0"
"F420500","Advanced diabetic retinal disease","92","0"
"2BBO.00","O/E - Laser photocoagulation scars","45","288"
